{
  "$schema": "http://json-schema.org/draft-07/schema#",
  "required": [
    "creationDateTime",
    "senderBusinessId"
  ],
  "definitions": {
    "account": {
      "type": "object",
      "description": "Account",
      "required": [
        "id",
        "openingDate",
        "roles"
      ],
      "properties": {
        "id": {
          "$ref": "#/definitions/accountIdentification"
        },
        "openingDate": {
          "description": "Account opening date.",
          "$ref": "#/definitions/date"
        },
        "closingDate": {
          "description": "Account closing date.",
          "$ref": "#/definitions/date"
        },
        "roles": {
          "type": "array",
          "description": "Account related roles. Role type has to be either owner or access.",
          "minItems": 1,
          "items": {
            "$ref": "#/definitions/role"
          }
        },
        "accountPurpose": {
          "type": "string",
          "description": "The purpose of the account, if applicable.",
          "enum": ["customer_asset_account"]
        }
      }
    },
    "accountIdentification": {
      "type": "object",
      "description": "Account identification.",
      "oneOf": [{
          "required": [
            "iban"
          ]
        },
        {
          "required": [
            "other"
          ]
        }
      ],
      "properties": {
        "iban": {
          "type": "string",
          "description": "IBAN account number.",
          "examples": [
            "FI2753564444694907"
          ]
        },
        "other": {
          "$ref": "#/definitions/otherAccountIdentification"
        }
      }
    },
    "businessId": {
      "type": "string",
      "description": "Business id or VAT number",
      "examples": [
        "0245442-8",
        "FI02454428",
        "SE999999999901",
        "NL999999999B01"
      ],
      "minLength": 4,
      "maxLength": 20,
      "pattern": "[A-Z|0-9|-]+"
    },
    "customer": {
      "type": "object",
      "description": "Customer.",
      "required": [
        "startDate"
      ],
      "properties": {
        "startDate": {
          "description": "Customer start date.",
          "$ref": "#/definitions/date"
        },
        "endDate": {
          "description": "Customer end date.",
          "$ref": "#/definitions/date"
        }
      }
    },
    "date": {
      "type": "string",
      "description": "The date format is YYYY-MM-DD.",
      "examples": [
        "2019-08-17"
      ]
    },
    "dateTime": {
      "type": "string",
      "description": "The dateTime format is YYYY-MM-DDThh:mm:ss.s.",
      "examples": [
        "2019-08-17T12:50:12.374"
      ]
    },
    "legalPerson": {
      "type": "object",
      "description": "Legal person which is always either a natural person (privatePerson) or a juridical person (organisation).",
      "properties": {
        "organisation": {
          "$ref": "#/definitions/organisation"
        },
        "privatePerson": {
          "$ref": "#/definitions/privatePerson"
        }
      },
      "oneOf": [{
          "required": [
            "organisation"
          ]
        },
        {
          "required": [
            "privatePerson"
          ]
        }
      ]
    },
    "organisation": {
      "type": "object",
      "description": "Juridical person.",
      "required": [
        "name",
        "registrationNumber",
        "roles"
      ],
      "properties": {
        "registrationNumber": {
          "type": "object",
          "required": [
            "number",
            "type"
          ],
          "properties": {
            "number": {
              "type": "string",
              "description": "Organisation registration number"
            },
            "type": {
              "$ref": "#/definitions/registrationNumberType"
            }
          }
        },
        "registrationAuthority": {
          "type": "string",
          "description": "Registration authority.",
          "maxLength": 70
        },
        "registrationDate": {
          "description": "Registration date.",
          "$ref": "#/definitions/date"
        },
        "roles": {
          "type": "array",
          "description": "Beneficiaries. Role type has to be beneficiary.",
          "items": {
            "$ref": "#/definitions/role"
          }
        },
        "name": {
          "type": "string",
          "description": "Organisation name.",
          "maxLength": 300
        },
        "orderNumber": {
          "type": "integer",
          "minimum": 0,
          "maximum": 255,
          "description": "Interest representative organisation order number, if applicable."
        }
      }
    },
    "otherAccountIdentification": {
      "type": "object",
      "description": "Other than IBAN account number.",
      "required": [
        "id",
        "description"
      ],
      "properties": {
        "id": {
          "type": "string",
          "description": "Account identification.",
          "maxLength": 200
        },
        "description": {
          "type": "string",
          "description": "Description of the used account identification type.",
          "maxLength": 200
        }
      }
    },
    "privatePerson": {
      "type": "object",
      "description": "Natural person.",
      "anyOf": [{
          "required": [
            "fullName",
            "birthDate",
            "hetu"
          ]
        },
        {
          "required": [
            "fullName",
            "birthDate",
            "nationalities"
          ]
        },
          {
          "required": [
            "fullName",
            "birthDate",
            "hetu",
            "nationalities"
          ]
        }
      ],
      "properties": {
        "fullName": {
          "type": "string",
          "description": "Full name.",
          "examples": [
            "Korhonen, Juhani Antti"
          ],
          "maxLength": 140
        },
        "birthDate": {
          "description": "Date of birth.",
          "$ref": "#/definitions/date"
        },
        "nationalities": {
          "description": "Nationalities",
          "type": "array",
          "items": {
            "type": "string",
            "minLength": 2,
            "maxLength": 2
          },
          "examples": [
            ["FI", "RU"]
          ]
        },
        "hetu": {
          "type": "string",
          "description": "Personal identity code (Finnish hetu).",
          "examples": [
            "151080-999L"
          ]
        }
      }
    },
    "role": {
      "type": "object",
      "description": "Role",
      "required": [
        "type",
        "legalPersonReference"
      ],
      "properties": {
        "startDate": {
          "description": "Role start date. Required for owner and access roles.",
          "$ref": "#/definitions/date"
        },
        "endDate": {
          "description": "Role end date.",
          "$ref": "#/definitions/date"
        },
        "type": {
          "type": "string",
          "description": "Role type.",
          "enum": ["owner", "access", "beneficiary"]
        },
        "legalPersonReference": {
          "description": "Legal person identifier",
          "$ref": "#/definitions/uuidv4"
        }
      }
    },
    "registrationNumberType": {
      "type": "string",
      "oneOf": [
        {
          "description": "Finnish business id (Y-tunnus)",
          "type": "string",
          "const": "businessId"
        },
        {
          "description": "Registration number of a Finnish association",
          "type": "string",
          "const": "associationRegistrationNumber"
        },
        {
          "description": "Generic registration number",
          "type": "string",
          "const": "registrationNumber"
        }
      ]
    },
    "safetyDepositBox": {
      "type": "object",
      "description": "Safety deposit box.",
      "required": [
        "id",
        "roles"
      ],
      "properties": {
        "id": {
          "type": "string",
          "description": "Safety deposit box identifier.",
          "examples": [
            "OKOYFIHH-41138848"
          ],
          "maxLength": 100
        },
        "startDate": {
          "description": "Safety deposit box start date.",
          "$ref": "#/definitions/date"
        },
        "endDate": {
          "description": "Safety deposit box end date.",
          "$ref": "#/definitions/date"
        },
        "roles": {
          "type": "array",
          "description": "Safety deposit box related roles. Role type has to be either owner or access.",
          "minItems": 1,
          "items": {
            "$ref": "#/definitions/role"
          }
        }
      }
    },
    "uuidv4": {
      "type": "string",
      "description": "Unambiguous identifier used for record. UUIDv4.",
      "examples": [
        "91e8c532-71e1-4c4f-bf30-ceec6160ece0"
      ]
    }
  },
  "properties": {
    "creationDateTime": {
      "$id": "#/properties/creationDateTime",
      "description": "Creation date and time of the message.",
      "$ref": "#/definitions/dateTime"
    },
    "senderBusinessId": {
      "$id": "#/properties/senderBusinessId",
      "description": "Sender business id or VAT number.",
      "$ref": "#/definitions/businessId"
    },
    "legalPersons": {
      "$id": "#/properties/legalPersons",
      "type": "object",
      "additionalProperties": {
        "$ref": "#/definitions/legalPerson"
      },
      "description": "Legal persons."
    },
    "customers": {
      "$id": "#/properties/customers",
      "type": "object",
      "additionalProperties": {
        "$ref": "#/definitions/customer"
      },
      "description": "Customers."
    },
    "accounts": {
      "$id": "#/properties/accounts",
      "type": "object",
      "additionalProperties": {
        "$ref": "#/definitions/account"
      },
      "description": "Accounts"
    },
    "safetyDepositBoxes": {
      "$id": "#/properties/safetyDepositBoxes",
      "type": "object",
      "additionalProperties": {
        "$ref": "#/definitions/safetyDepositBox"
      },
      "description": "Safety deposit boxes."
    }
  }
}
