{
  "creationDateTime": "2025-10-24T12:50:12.374",
  "senderBusinessId": "8488829-6",
  "legalPersons": {
    "5d892fac-07f0-465f-ab6a-af88a1d922ba": {
      "organisation": {
        "registrationAuthority": "PRH",
        "registrationNumber":
        {
          "number": "4276521-2",
          "type": "businessId"
        },
        "registrationDate": "1965-05-09",
        "name": "Firma Oy",
        "roles": [{
          "legalPersonReference": "6cd7cc3f-6de1-4583-a572-895613e71130",
          "startDate": "1999-11-10",
          "type": "beneficiary"
        },
          {
            "legalPersonReference": "cc695a85-32a9-4cf7-88a3-9b635f5c03b5",
            "startDate": "1970-01-04",
            "type": "beneficiary"
          },
          {
            "legalPersonReference": "edfb750c-26e6-44fc-b857-bd0caa06b74e",
            "startDate": "2006-09-09",
            "endDate": "2022-11-14",
            "type": "beneficiary"
          }
        ]
      }
    },
    "e12bb4e6-eb8b-48c4-b297-95e38dd0d776": {
      "organisation": {
        "registrationAuthority": "PRH",
        "registrationNumber":
        {
          "number": "4448861-8",
          "type": "businessId"
        },
        "registrationDate": "2001-02-03",
        "name": "Interest Representative",
        "roles": [],
        "orderNumber": 1
      }
    },
    "6cd7cc3f-6de1-4583-a572-895613e71130": {
      "privatePerson": {
        "fullName": "Fredlund, Eeva-Sofia",
        "hetu": "010659-9744",
        "birthDate": "1959-06-01"
      }
    },
    "cc695a85-32a9-4cf7-88a3-9b635f5c03b5": {
      "privatePerson": {
        "fullName": "Heimlander, Raimond Ernst",
        "hetu": "100368-970P",
        "birthDate": "1968-03-14"
      }
    },
    "edfb750c-26e6-44fc-b857-bd0caa06b74e": {
      "privatePerson": {
        "fullName": "Suppala, Atsalea Achieng",
        "hetu": "211156-926R",
        "birthDate": "1956-11-21"
      }
    },
    "e4a623ca-0ad7-4f3b-9b9e-81109b33da27": {
      "privatePerson": {
        "fullName": "Onnenlehto, Jarl-Olof Lassi",
        "birthDate": "1969-12-20",
        "nationalities": ["SE", "FI"]
      }
    },
    "a092893a-14e5-4b8d-adaf-80c1b7be95b6": {
      "privatePerson": {
        "fullName": "Utukka, Emelia Terella",
        "birthDate": "1970-07-25",
        "nationalities": ["SE", "FI"]
      }
    },
    "82911739-6f97-439e-b561-22fac327b774": {
      "privatePerson": {
        "fullName": "Tiiri, Lawrence Samuel",
        "hetu": "070280-9137",
        "birthDate": "1980-02-07"
      }
    },
    "3b153d44-4caa-4feb-bdd1-a91b6b1759ce": {
      "privatePerson": {
        "fullName": "Cooper, Anna-Roosa Vivika",
        "hetu": "241100A948X",
        "birthDate": "2000-11-24"
      }
    },
    "ebab0a47-00a7-4d56-aa63-028102d7a329": {
      "privatePerson": {
        "fullName": "Långfors, Pirjo-Kaarina Daniela",
        "hetu": "020783-900C",
        "birthDate": "1983-07-02"
      }
    },
    "279aeafc-528e-4f81-b79c-ecc8b0aafd4c": {
      "organisation": {
        "registrationAuthority": "PRH",
        "registrationDate": "1989-08-25",
        "registrationNumber":
        {
          "number": "0245442-8",
          "type": "associationRegistrationNumber"
        },
        "name": "Yhdistys Ry",
        "roles": [{
          "legalPersonReference": "a51b4ee8-1ec1-48ae-8d14-5948118a9659",
          "startDate": "1989-11-12",
          "type": "beneficiary"
        },
          {
            "legalPersonReference": "1b420512-acad-4ce4-be24-f73f0e078e8b",
            "startDate": "1989-11-12",
            "type": "beneficiary"
          }
        ]
      }
    },
    "a51b4ee8-1ec1-48ae-8d14-5948118a9659": {
      "privatePerson": {
        "fullName": "Ehnqvist, Taisa Annele",
        "hetu": "180971-9328",
        "birthDate": "1971-09-18"
      }
    },
    "1b420512-acad-4ce4-be24-f73f0e078e8b": {
      "privatePerson": {
        "fullName": "Järvenoja, Lise-Lott Herta",
        "hetu": "250578-980W",
        "birthDate": "1978-05-25"
      }
    },
    "70904e2d-87b8-4e3b-8421-b0907a62dd96": {
      "privatePerson": {
        "fullName": "Miettinen, Matti Pekka",
        "hetu": "030289-1179",
        "birthDate": "1989-03-02"
      }
    }
  },
  "customers": {
    "5d892fac-07f0-465f-ab6a-af88a1d922ba": {
      "startDate": "2000-12-31"
    },
    "279aeafc-528e-4f81-b79c-ecc8b0aafd4c": {
      "startDate": "2012-12-30"
    },
    "a092893a-14e5-4b8d-adaf-80c1b7be95b6": {
      "startDate": "2013-09-20",
      "endDate": "2024-01-21"
    },
    "70904e2d-87b8-4e3b-8421-b0907a62dd96": {
      "startDate": "2018-10-11"
    },
    "82911739-6f97-439e-b561-22fac327b774": {
      "startDate": "2010-08-26"
    },
    "3b153d44-4caa-4feb-bdd1-a91b6b1759ce": {
      "startDate": "2015-02-11",
      "endDate": "2022-07-03"
    },
    "ebab0a47-00a7-4d56-aa63-028102d7a329": {
      "startDate": "2015-09-30",
      "endDate": "2022-07-03"
    },
    "e4a623ca-0ad7-4f3b-9b9e-81109b33da27": {
      "startDate": "2015-09-30",
      "endDate": "2024-01-21"
    }
  },
  "accounts": {
    "6c035985-976f-4fa6-afcb-e1745eb58f9d": {
      "id": {
        "iban": "FI8371356610003253"
      },
      "openingDate": "2016-11-30",
      "roles": [{
        "legalPersonReference": "5d892fac-07f0-465f-ab6a-af88a1d922ba",
        "startDate": "2016-11-30",
        "type": "owner"
      }]
    },
    "b7b8ab37-9480-46aa-a3fc-5a946ce39d13": {
      "id": {
        "other": {
          "id": "HR8320134556",
          "description": "other account id"
        }
      },
      "openingDate": "2010-10-30",
      "closingDate": "2023-01-21",
      "roles": [{
        "legalPersonReference": "e4a623ca-0ad7-4f3b-9b9e-81109b33da27",
        "startDate": "2010-11-12",
        "endDate": "2024-01-21",
        "type": "owner"
      },
        {
          "legalPersonReference": "a092893a-14e5-4b8d-adaf-80c1b7be95b6",
          "startDate": "2013-09-20",
          "endDate": "2024-01-21",
          "type": "access"
        }
      ]
    },
    "116f9e18-2ba5-45de-9b88-ab5767c4e6e7": {
      "id": {
        "iban": "FI3749321479839355"
      },
      "openingDate": "2018-10-11",
      "roles": [{
        "legalPersonReference": "70904e2d-87b8-4e3b-8421-b0907a62dd96",
        "startDate": "2018-10-11",
        "type": "owner"
      }],
      "accountPurpose": "customer_asset_account"
    },
    "6b1688d7-e2d4-49f8-bc29-e6d5e49ee8de": {
      "id": {
        "iban": "FI0234394530008496"
      },
      "openingDate": "2010-08-26",
      "roles": [{
        "legalPersonReference": "82911739-6f97-439e-b561-22fac327b774",
        "startDate": "2010-08-26",
        "type": "owner"
      },
        {
          "legalPersonReference": "e12bb4e6-eb8b-48c4-b297-95e38dd0d776",
          "startDate": "2020-01-26",
          "type": "access"
        }]
    }
  },
  "safetyDepositBoxes": {
    "1c80bbfb-9d60-438c-9909-a2c628ffa1b5": {
      "id": "FI-3450200224",
      "startDate": "2015-02-11",
      "endDate": "2022-07-03",
      "roles": [{
        "legalPersonReference": "82911739-6f97-439e-b561-22fac327b774",
        "startDate": "2015-02-11",
        "endDate": "2022-07-03",
        "type": "owner"
      },
        {
          "legalPersonReference": "3b153d44-4caa-4feb-bdd1-a91b6b1759ce",
          "startDate": "2015-02-11",
          "endDate": "2022-07-03",
          "type": "access"
        },
        {
          "legalPersonReference": "ebab0a47-00a7-4d56-aa63-028102d7a329",
          "startDate": "2015-09-30",
          "endDate": "2022-07-03",
          "type": "access"
        }
      ]
    },
    "4c3eb524-0c06-4575-9cc2-f1a248f76bb1": {
      "id": "FI-772078676",
      "startDate": "2016-02-11",
      "roles": [{
        "legalPersonReference": "279aeafc-528e-4f81-b79c-ecc8b0aafd4c",
        "startDate": "2016-12-30",
        "type": "owner"
      }]
    }
  }
}
